{"$schema":"https://json-schema.org/draft/2020-12/schema","additionalProperties":false,"properties":{"aws_identity":{"const":"matched"},"bundle_bytes":{"const":114746920},"bundle_ciphertext_sha256":{"const":"4b62aaa4857ec68822392752d3cce758af981e106b79d8cb969cd6538bb14164"},"exact_version":{"const":"matched"},"kms_encryption":{"const":"matched"},"selected_version_current":{"type":"boolean"},"state":{"const":"retrieved-verified-removed"},"verified_at":{"pattern":"^[0-9]{4}-[0-9]{2}-[0-9]{2}T[0-9]{2}:[0-9]{2}:[0-9]{2}Z$","type":"string"},"version":{"const":1}},"required":["aws_identity","bundle_bytes","bundle_ciphertext_sha256","exact_version","kms_encryption","selected_version_current","state","verified_at","version"],"type":"object"}
