{"aws_identity":"matched","bundle_bytes":114746920,"bundle_ciphertext_sha256":"4b62aaa4857ec68822392752d3cce758af981e106b79d8cb969cd6538bb14164","exact_version":"matched","kms_encryption":"matched","selected_version_current":true,"state":"retrieved-verified-removed","verified_at":"2026-09-19T03:11:27Z","version":1}
